{
  "paths": {
    "features": "Features",
    "testResults": "TestResults",
    "output": "living-documentation.html"
  },
  "documentation": {
    "title": "IntegrationTest .NET 8 - Living Documentation",
    "theme": "blue"
  },
  "advanced": {
    "includeTestResults": true,
    "includeComments": true
  },
  "testResults": {
    "format": "nunit"
  }
}
